{
  "schema_version": 1,
  "protocol_version": "1.0",
  "handoff_id": "predictive-survival-runtime-state-machine-complete-20260828",
  "task_id": "build-predictive-survival-26-1-2",
  "from_agent": "openai-survival-runtime-5f6c",
  "to_agent": "openai-survival-exec-9b42",
  "summary": "The approved Predictive Survival 26.1.2 runtime state-machine/deep-audit implementation is complete and verified on PR #46. The PR is ready for review and intentionally remains unmerged.",
  "completed": [
    "Implemented server-authority projection and reconciliation for death-protection routing, including hotbar and offhand optimistic-state races.",
    "Closed latency/observation-age, Bow first-legal-release, real Power V Bow, loaded-crossbow Harming, melee/mace/spear, Kinetic spear, and Elytra authority gates with source-backed deterministic or exact-runtime coverage.",
    "Verified non-Totem planner actions, shield warmup/inventory reconciliation, multi-hit/hurt-cooldown semantics, explosion exposure, bypass tags, performance bounds, production-JAR isolation, and complete packaging.",
    "Updated INSTANT_BURST_AUDIT.md and PR #46 so documented claims match the current 26.1.2 source and exact-runtime evidence.",
    "Marked PR #46 ready for review at head 411aa91a6745a4d132f99dd9ecc27f17c784f2b2."
  ],
  "remaining": [
    "Owner/coordinator review and merge of PR #46 into project/predictive-survival-26-1-2 if approved. No implementation work remains under the approved plan."
  ],
  "next_action": "Review PR #46 at head 411aa91a6745a4d132f99dd9ecc27f17c784f2b2 and merge it into project/predictive-survival-26-1-2 if desired; rerun full verification if the PR head changes before merge.",
  "files_changed": [
    "projects/predictive-survival-26-1-2",
    ".github/workflows/predictive-survival-26-1-2-ci.yml"
  ],
  "verification": [
    "PR merge ref 2c98d17bb573a0e601a16f7f8d7a694c9df2d843 tested against head 411aa91a6745a4d132f99dd9ecc27f17c784f2b2",
    "Predictive Survival CI run 33168173231: success",
    "Java 25 ./gradlew --no-daemon clean test build: BUILD SUCCESSFUL",
    "client GameTest compilation: success",
    "exact-runtime client GameTests: success",
    "production-JAR isolation: success",
    "complete deliverable packaging and both artifact uploads: success",
    "workspace validation run 33168173214: success",
    "production artifact 9684521932; complete deliverables artifact 9684522350"
  ],
  "risks": [
    "PR #46 is not merged; the canonical project branch remains unchanged until a reviewer merges it.",
    "Documented fail-closed limitations for server-hidden state remain intentional and should not be weakened without new exact-runtime evidence."
  ],
  "created_at": "2026-08-28T11:49:00+00:00"
}
