{
  "schema_version": 1,
  "protocol_version": "1.0",
  "handoff_id": "fedcba9876543210fedcba9876543210",
  "task_id": "example-task",
  "from_agent": "example-agent-a1b2",
  "to_agent": "review-agent-c3d4",
  "summary": "Documentation draft is ready for verification",
  "completed": ["Wrote the startup guide"],
  "remaining": ["Run every command in a clean workspace"],
  "next_action": "Execute the quick-start commands and report mismatches",
  "files_changed": ["AGENTS.md", "README.md"],
  "verification": ["python -m unittest discover -s tests -v"],
  "risks": ["Examples may drift if CLI flags change"],
  "created_at": "2026-08-01T12:30:00+00:00"
}
